id,category,title,description,conversation_id,report_id,votes,comments,create_date
2,1,日本においてスパイ防止法は必要か？,日本社会で論点が分かれる「スパイ防止法」について、背景には情報の取り扱いと自由のバランスがある。支持派は、国家機密と国民安全を守るために必要と主張し、適用基準の厳格化・監視の限定・裁判所令状の必須化・透明性確保を求める。一方、反対派は取材・表現の自由を萎縮させる恐れを挙げ、既存法の運用改善や民間監視の強化、教育啓発の併用を重視する。過去の議論では、法の恣意運用防止や透明性、専門家の評価・改正を組み込むべきとの声も多い。という問題についてどう考えるべきだろうか？,2db2nr8fsm,r5dwm6xxjztf8mspj76m3,26,15,2025-11-08 17:51:04
3,1,中国製IT機器、生産国からの不正アクセスが可能な問題についてどう向き合うべきか？,テーマは「中国製IT機器が生産国からの不正アクセスを許す可能性がある問題への向き合い方」。背景には、重要インフラや政府調達を巡るリスク分散と信頼性の課題がある。立場は二つ：1) 中国由来の侵略リスクを踏まえ、国内または同盟国供給に絞るべき、2) 経済合理性を優先し、中国製品も活用しつつリスク対策を進めるべき、だ。意見には、国内・同盟国への供給限定による監視強化、政府主導の信頼性評価義務化、透明な調達と定期監査、国内産業の技術自立、共通セキュリティ基準・相互認証、AI監視による早期検知、重要インフラの段階的置換、公的除外リストの明確化など、多様な施策が挙げられる。背景情報として、国際的なサプライチェーンの分散化や監視体制の強化が喫緊の課題であり、企業と政府の協力・透明性が不可欠だ。こうした論点を踏まえ、国内外の安全保障と経済のバランスをどう取るべきか、という問いが浮かぶ。という問題についてどう考えるべきだろうか？,2azvfk33hw,r56cfrm5uunyd4mfemnnr,15,15,2025-11-08 18:21:03
4,4,外国人による土葬問題について日本はどう対応すべきか？,"テーマは外国人による土葬問題と日本の対応。
背景には、多文化共生の現実化と、日本固有の死生観・法秩序の対立がある。新宿区の財政負担や、墓地資源の圧迫、国外慣習の影響を巡る議論が進む一方、土葬地の新設や区域別スペース設置など柔軟運用を求める声もある。
立場は大きく二つ。多文化共生を優先し、土葬制度の拡充や規制緩和を検討する意見と、日本の死生観・法秩序を守り厳格規制を維持すべきとの意見だ。
両者は対話と透明性、合意形成を前提に折衝すべきだろう。この問題についてどう考えるべきだろうか？",5etkvd3ncy,r7ewnknffjw8kexs5m5hj,27,16,2025-11-08 18:22:03
5,1,外国人による日本のルールへの無理解、どう対応していくべきか？,外国人による日本のルール理解不足の是非を問うテーマ。背景には、多言語情報の不足や現場の教育機会不足、地域との連携不足がある一方で、インフルエンザ拡大の警戒や治安・秩序維持の観点から規制強化の声もある。意見は大きく二分。 (1) 教育と対話で解消すべき派は、多言語情報提供・地域学校連携・体験型教育・オンライン・対面の24時間場など継続的な学習機会を提案。 (2) 規制強化・周知効率化派は、日本語教育・分かりやすい標識・違反時の罰則統一・執行透明化を挙げ、違反再発を抑止すべきとする。という問題についてどう考えるべきだろうか？,26enwazbxi,r6uyvws5pvv4zbvmxbmfi,16,8,2025-11-08 19:00:47